{
  "$schema": "https://json-schema.org/draft/2020-12/schema",
  "$id": "tool.manifest.schema.json",
  "title": "Tool Manifest",
  "type": "object",
  "additionalProperties": false,
  "required": ["tool_id", "version", "entrypoints", "modes", "inputs", "outputs"],
  "properties": {
    "tool_id": {"type": "string", "minLength": 1},
    "version": {"type": "string", "minLength": 1},
    "description": {"type": "string"},
    "entrypoints": {
      "type": "array",
      "minItems": 1,
      "items": {
        "type": "object",
        "additionalProperties": false,
        "required": ["name", "path"],
        "properties": {
          "name": {"type": "string", "minLength": 1},
          "path": {"type": "string", "minLength": 1},
          "kind": {"type": "string", "enum": ["cli", "module", "service"]}
        }
      }
    },
    "modes": {
      "type": "array",
      "minItems": 1,
      "items": {
        "type": "object",
        "additionalProperties": false,
        "required": ["name"],
        "properties": {
          "name": {"type": "string", "minLength": 1},
          "description": {"type": "string"},
          "flags": {"type": "array", "items": {"type": "string"}}
        }
      }
    },
    "inputs": {
      "type": "array",
      "items": {
        "type": "object",
        "additionalProperties": false,
        "required": ["name", "schema_ref"],
        "properties": {
          "name": {"type": "string", "minLength": 1},
          "schema_ref": {"type": "string", "minLength": 1}
        }
      }
    },
    "outputs": {
      "type": "array",
      "items": {
        "type": "object",
        "additionalProperties": false,
        "required": ["name", "schema_ref"],
        "properties": {
          "name": {"type": "string", "minLength": 1},
          "schema_ref": {"type": "string", "minLength": 1}
        }
      }
    },
    "exceptions": {
      "type": "array",
      "items": {
        "type": "object",
        "additionalProperties": false,
        "required": ["path"],
        "properties": {
          "path": {"type": "string", "minLength": 1},
          "expiry": {"type": "string", "minLength": 1},
          "approver": {"type": "string", "minLength": 1}
        }
      }
    },
    "metadata": {"type": "object", "additionalProperties": true}
  }
}
